{
  "schema_version": "1.0.0",
  "graph_id": "nmlt-phase6-graph-v1:sha256:9ed3e3b1882c1dc983e66beb0d03415bcd558753edb39966ba6ad4bc71006439",
  "fixture": "authority-repair-and-runtime-drift-v1",
  "evaluation_binding": {
    "path": "benchmarks/agentic/evaluation.json",
    "content_sha256": "sha256:86a5f398729fa80ea45da3299f7ae6bdad1ff3d07f92638127d46a7876c8a011",
    "suite_path": "benchmarks/agentic/suite.json",
    "suite_sha256": "sha256:e174374c63d1284d28c8220538bdc9e8955483373a3b83fa2fc0c4c82bbf3fa6",
    "assistant_kind": "deterministic_protocol_conformance_baseline_not_llm_evidence",
    "checker_id": "nmlt-agent-held-out-checker-v1"
  },
  "runtime_binding": {
    "path": "benchmarks/results/temporal/phase4-evidence.json",
    "content_sha256": "sha256:3efe4567a22034a2955ce3a53101b1e925084865868cb1a17fdb42bb62138128",
    "model_id": "nmlt-temporal-graph-v1:sha256:7cd9a36ee384964f76b4c3f8b9ea0ccad3016c9e178f864629a5ac7ed6dd849f",
    "implementation_id": "nmlt-temporal-source-set-v1:sha256:b5d0f06b74e95f28d4bc02961e75be2cee5fadc226c36e15a3c169aa62988453",
    "runtime_case_id": "nmlt-runtime-case-v1:sha256:0ca55bde00d4edd46c5e9a8a5f451d88f479221bfd618e71fbf3846c8e62ec34",
    "journal_id": "nmlt-journal-v1:sha256:a99cb72003cda02e367b83ccec66898ae0d76f766358d9d374b90f073e7a1e47",
    "classification": "rejected",
    "record_index": 1,
    "reason": "record 1 action/observations match no transition from candidate states {0}"
  },
  "metrics": {
    "tasks": 3,
    "baseline_completed": 0,
    "assisted_completed": 3,
    "integrity_attempts": 21,
    "integrity_rejections": 21,
    "controls_retained": 3,
    "controls_killed": 3,
    "unknown_promotions": 0,
    "conflict_promotions": 0
  },
  "nodes": [
    {
      "id": "candidate:held-out-semantic-authority",
      "role": "candidate",
      "digest": "sha256:58bdcf012d4f4acf84d7c8ebf70509e0637814036a854b6f6a791cde59a00dcb",
      "summary": "held-out baseline candidate",
      "result_class": null,
      "path": "benchmarks/agentic/candidates/held-out-semantic.nmlt"
    },
    {
      "id": "candidate:held-out-syntax-terminator",
      "role": "candidate",
      "digest": "sha256:2e6ae249d03ca68f86704876d945f7cd01389bd44d96e8895f8280841e34892f",
      "summary": "held-out baseline candidate",
      "result_class": null,
      "path": "benchmarks/agentic/candidates/held-out-syntax.nmlt"
    },
    {
      "id": "candidate:held-out-type-boolean",
      "role": "candidate",
      "digest": "sha256:cc0809757ff27de36186ea30570115c10c7252a3860e77ef027a9ed8a643f6ca",
      "summary": "held-out baseline candidate",
      "result_class": null,
      "path": "benchmarks/agentic/candidates/held-out-type.nmlt"
    },
    {
      "id": "evaluation:held-out-semantic-authority",
      "role": "evaluation",
      "digest": "sha256:2558d78c9f8f1dce400efc2d9cc0c45463d6d5e37f7101864bdf0151bf56870f",
      "summary": "isolated full recheck with controls",
      "result_class": "model_checked"
    },
    {
      "id": "evaluation:held-out-syntax-terminator",
      "role": "evaluation",
      "digest": "sha256:94fa5fa35dec5481efeeb0111b959f994413272b8fcfcad4644caea1fb0427ef",
      "summary": "isolated full recheck with controls",
      "result_class": "syntax_accepted"
    },
    {
      "id": "evaluation:held-out-type-boolean",
      "role": "evaluation",
      "digest": "sha256:bdd45eeeb232a3758ce9f6c575a3f33247c9f896981e759b0448135fd91760a2",
      "summary": "isolated full recheck with controls",
      "result_class": "type_accepted"
    },
    {
      "id": "evidence:nmlt-agentic-held-out-v1",
      "role": "evidence",
      "digest": "sha256:86a5f398729fa80ea45da3299f7ae6bdad1ff3d07f92638127d46a7876c8a011",
      "summary": "deterministic authority-bounded repair evaluation",
      "result_class": "tested",
      "path": "benchmarks/agentic/evaluation.json"
    },
    {
      "id": "feedback:held-out-semantic-authority",
      "role": "feedback",
      "digest": "sha256:b3ecae138ee012fcbb5db6d98aa4eb2ab987e84ddf70205ae76469318d6d9f35",
      "summary": "checker-produced structured baseline feedback",
      "result_class": "refuted"
    },
    {
      "id": "feedback:held-out-syntax-terminator",
      "role": "feedback",
      "digest": "sha256:68e6726762f603e40d33343e1c9de0bea7b896827cde33dda106ebe8d0e8430a",
      "summary": "checker-produced structured baseline feedback",
      "result_class": "refuted"
    },
    {
      "id": "feedback:held-out-type-boolean",
      "role": "feedback",
      "digest": "sha256:e2795646c037fac89698542452ebf88527d572d2e970d72050cdb1a168031c50",
      "summary": "checker-produced structured baseline feedback",
      "result_class": "refuted"
    },
    {
      "id": "intent:held-out-semantic-authority",
      "role": "intent",
      "digest": "sha256:3c60135fbce33efc18a56582c3f76b302b9d1fc571cebd340ce1e065c952480f",
      "summary": "frozen intent for held-out-semantic-authority",
      "result_class": null,
      "path": "benchmarks/agentic/trusted/held-out-semantic-authority.intent.txt"
    },
    {
      "id": "intent:held-out-syntax-terminator",
      "role": "intent",
      "digest": "sha256:c9249df557c510b9e846f3f4556570d0d40215bcda5b0edd78de634fff1cff97",
      "summary": "frozen intent for held-out-syntax-terminator",
      "result_class": null,
      "path": "benchmarks/agentic/trusted/held-out-syntax-terminator.intent.txt"
    },
    {
      "id": "intent:held-out-type-boolean",
      "role": "intent",
      "digest": "sha256:d00d7b5df770f3cbb49f66d92ddf57422095707118fd08da5560e24cbd6fa5a6",
      "summary": "frozen intent for held-out-type-boolean",
      "result_class": null,
      "path": "benchmarks/agentic/trusted/held-out-type-boolean.intent.txt"
    },
    {
      "id": "oracle:held-out-semantic-authority",
      "role": "oracle",
      "digest": "sha256:d9d2e6414bbc8704b3df106604bf27dd685a7d6757aa1f1688b1c39b7c0b7771",
      "summary": "frozen oracle for held-out-semantic-authority",
      "result_class": null,
      "path": "benchmarks/agentic/trusted/held-out-semantic-authority.oracle.txt"
    },
    {
      "id": "oracle:held-out-syntax-terminator",
      "role": "oracle",
      "digest": "sha256:7e73614c148c2bcba13974fbca8d9f64d694c676da3abc3381cbecb7309b7248",
      "summary": "frozen oracle for held-out-syntax-terminator",
      "result_class": null,
      "path": "benchmarks/agentic/trusted/held-out-syntax-terminator.oracle.txt"
    },
    {
      "id": "oracle:held-out-type-boolean",
      "role": "oracle",
      "digest": "sha256:a0348843c17e37c03bad959fc28aaa4cf515e00415b54a50767f5c6473992762",
      "summary": "frozen oracle for held-out-type-boolean",
      "result_class": null,
      "path": "benchmarks/agentic/trusted/held-out-type-boolean.oracle.txt"
    },
    {
      "id": "property:held-out-semantic-authority",
      "role": "property",
      "digest": "sha256:afc21934e5b88731c9c92895d46f779ff1b023fd3547dd61c9b5f82e43be6bc7",
      "summary": "frozen property for held-out-semantic-authority",
      "result_class": null,
      "path": "benchmarks/agentic/trusted/held-out-semantic-authority.property.txt"
    },
    {
      "id": "property:held-out-syntax-terminator",
      "role": "property",
      "digest": "sha256:0ee640a865a7a2060289dff9254a9e5395e7d94865f248eedf187f353a147940",
      "summary": "frozen property for held-out-syntax-terminator",
      "result_class": null,
      "path": "benchmarks/agentic/trusted/held-out-syntax-terminator.property.txt"
    },
    {
      "id": "property:held-out-type-boolean",
      "role": "property",
      "digest": "sha256:24db0a9128b80f319b5349dea00a68f8700b5935cc978ac2acdde475fd0602cf",
      "summary": "frozen property for held-out-type-boolean",
      "result_class": null,
      "path": "benchmarks/agentic/trusted/held-out-type-boolean.property.txt"
    },
    {
      "id": "proposal:sha256:3b0abb3b0ea5f2ae04925abc768a3b7cf933202f0c284dd0e8d9ac885c48ccae",
      "role": "proposal",
      "digest": "sha256:3b0abb3b0ea5f2ae04925abc768a3b7cf933202f0c284dd0e8d9ac885c48ccae",
      "summary": "untrusted localized proposal",
      "result_class": null
    },
    {
      "id": "proposal:sha256:6a97719486ceeee77b6532a08ff37d6a146df76224ec4d76e0cf2aad3b10ef3b",
      "role": "proposal",
      "digest": "sha256:6a97719486ceeee77b6532a08ff37d6a146df76224ec4d76e0cf2aad3b10ef3b",
      "summary": "untrusted localized proposal",
      "result_class": null
    },
    {
      "id": "proposal:sha256:fed73e460e44d62fdc6e88f437b0eca4da420a3a71867130747111a097fc4506",
      "role": "proposal",
      "digest": "sha256:fed73e460e44d62fdc6e88f437b0eca4da420a3a71867130747111a097fc4506",
      "summary": "untrusted localized proposal",
      "result_class": null
    },
    {
      "id": "residual-gaps:sha256:2f407aa69683406a6021d74b8a9c37f9df1806a04339f9b5c412641d198cb0fd",
      "role": "residual_gaps",
      "digest": "sha256:2f407aa69683406a6021d74b8a9c37f9df1806a04339f9b5c412641d198cb0fd",
      "summary": "explicit limitations of the Phase 6 combined claim",
      "result_class": null,
      "locator": "$.residual_gaps"
    },
    {
      "id": "runtime-drift:sha256:1e7035e12df3dfd08cd06422c4da2081579890050905a0d1af5ef24abe99d9c7",
      "role": "drift_event",
      "digest": "sha256:1e7035e12df3dfd08cd06422c4da2081579890050905a0d1af5ef24abe99d9c7",
      "summary": "record 1 action/observations match no transition from candidate states {0}",
      "result_class": "rejected",
      "path": "benchmarks/results/temporal/phase4-evidence.json",
      "locator": "$.runtime",
      "binding_id": "nmlt-runtime-case-v1:sha256:0ca55bde00d4edd46c5e9a8a5f451d88f479221bfd618e71fbf3846c8e62ec34"
    },
    {
      "id": "runtime-implementation:nmlt-temporal-source-set-v1:sha256:b5d0f06b74e95f28d4bc02961e75be2cee5fadc226c36e15a3c169aa62988453",
      "role": "implementation",
      "digest": "sha256:b5d0f06b74e95f28d4bc02961e75be2cee5fadc226c36e15a3c169aa62988453",